### ISSUE TITLE
Suspected censorship of sosistab3 with MCI (AS197207)

### ISSUE THREAD

**Issue by nullchinchilla** [geph-official/geph5#51]
From a testing server from AS197207, I've observed:
- Plus bridges on obscure ISPs *not* blocked --- this is leading to Plus users in Iran having traffic routed through Asian bridges designed for Chinese users
- Bridges on Scaleway and OVH have a strange censorship behavior:
    - the `sosistab3` handshake may or may not complete, seemingly depending on the amount of padding placed in the initial client-side handshake
    - the authentication handshake often does complete, and the client seems to enter the main loop correctly

The bridge-side packet capture looks like this:

```
   76 36.637240647 148.113.137.211 → 89.198.xxx.xxx TCP 66 32985 → 41186 [ACK] Seq=5523 Ack=2984 Win=65536 Len=0 TSval=1162159677 TSecr=573258469
   77 36.724202202 148.113.137.211 → 89.198.xxx.xxx TCP 110 32985 → 41186 [PSH, ACK] Seq=5523 Ack=2984 Win=65536 Len=44 TSval=1162159764 TSecr=573258469
   78 37.344202655 148.113.137.211 → 89.198.xxx.xxx TCP 110 [TCP Retransmission] 32985 → 41186 [PSH, ACK] Seq=5523 Ack=2984 Win=65536 Len=44 TSval=1162160384 TSecr=573258469
   79 37.351583661 89.198.xxx.xxx → 148.113.137.211 TCP 54 45294 → 46093 [RST, ACK] Seq=1 Ack=1 Win=0 Len=0
   80 37.952647828 148.113.137.211 → 89.198.xxx.xxx TCP 110 [TCP Retransmission] 32985 → 41186 [PSH, ACK] Seq=5523 Ack=2984 Win=65536 Len=44 TSval=1162160992 TSecr=573258469
   81 39.168186913 148.113.137.211 → 89.198.xxx.xxx TCP 110 [TCP Retransmission] 32985 → 41186 [PSH, ACK] Seq=5523 Ack=2984 Win=65536 Len=44 TSval=1162162208 TSecr=573258469
   82 41.792191929 148.113.137.211 → 89.198.xxx.xxx TCP 110 [TCP Retransmission] 32985 → 41186 [PSH, ACK] Seq=5523 Ack=2984 Win=65536 Len=44 TSval=1162164832 TSecr=573258469
   ```

The repeatedly retransmitted packets actually end up at the client side. The client attempts to ACK them, but the ACKs seem to be blocked.

**Comment by nullchinchilla** [comment]
Currently there are two possibilities:
- Some sort of packet-length-based fingerprinting of sosistab3. This is very possible at the moment, since *only the handshake has random padding added*. To test whether this is the case, we can implement and enable payload padding in sosistab3.
- Some sort of blanket high-entropy ban, similar to [the famous GFW ban a while ago](https://gfw.report/publications/usenixsecurity23/en/) (which currently does not seem active on the bridges we use). Fixing this will need, say, TLS or simialr transports.

**Comment by nullchinchilla** [comment]
Okay, I did some testing, and here's what I've observed:
- *raw* picomux between Iran and outside: :heavy_check_mark: 
- uploading a continual stream of random garbage out of Iran: :x: 
- uploading a continual stream of zeroes out of Iran: :x: 
- uploading a continual stream of "aaaaaaaaaaaaaaaaaaaa" out of Iran: :heavy_check_mark: 
- uploading a continual stream of "helloworldfoobarbar" out of Iran: :heavy_check_mark: 

So this seems to be strong evidence that Iran simply blocks high-entropy traffic, and does so very quickly (probably by simply checking how compressible the traffic is?)

I will do some testing by sending some lower-entropy pseudorandom data.

**Comment by nullchinchilla** [comment]
Pending more transports (e.g. obfuscated TLS like Geph 4), we're going to work around this by selectively pushing routes with plain (unobfuscated) protocols.

**Comment by irgfw** [comment]
We can confirm this.

MCI is upgraded to block high-entropy and unknown traffic. we observed this on VMESS and ShadowSocks as well.

0. https://x.com/ir_gfw/status/1871432520450900354

1. https://github.com/net4people/bbs/issues/441

**Comment by nullchinchilla** [comment]
This is currently worked around very well.
